{
  "$schema": "http://json-schema.org/draft-07/schema#",
  "$id": "https://canon.viridis.security/schemas/vulnerability.schema.json",
  "title": "VulnCanon Entry",
  "description": "Canonical schema for a compiled vulnerability theorem entry. Every accepted entry in VulnCanon must validate against this schema. The schema is the contract that prevents prose-only submissions from entering the canon.",
  "type": "object",
  "required": [
    "id",
    "title",
    "class",
    "status",
    "severity",
    "invariant",
    "preconditions",
    "claim",
    "evidence",
    "mitigation",
    "contributor",
    "created_at"
  ],
  "additionalProperties": false,
  "properties": {
    "id": {
      "description": "Canonical identifier. Format: VC-<CATEGORY>-<TOPIC>-<NNNN>",
      "type": "string",
      "pattern": "^VC-[A-Z]+(-[A-Z]+)?-[0-9]{4}$"
    },
    "title": {
      "description": "Human-readable title.",
      "type": "string",
      "minLength": 8,
      "maxLength": 140
    },
    "class": {
      "description": "Vulnerability class taxonomy.",
      "type": "string",
      "enum": [
        "AI Agent Authorization Failure",
        "AI Agent Trust Boundary Crossing",
        "AI Agent Memory Disclosure",
        "AI Agent Irreversible Action",
        "AI Agent System Prompt Disclosure",
        "Authentication and Authorization",
        "Injection",
        "Secret Leakage",
        "File Handling",
        "Cryptography Misuse",
        "API Exposure",
        "Payment Logic",
        "Race Condition",
        "Supply Chain",
        "Configuration",
        "Data Exposure"
      ]
    },
    "status": {
      "type": "string",
      "enum": ["draft", "review", "accepted", "deprecated", "withdrawn"]
    },
    "severity": {
      "type": "string",
      "enum": ["informational", "low", "medium", "high", "critical"]
    },
    "invariant": {
      "type": "object",
      "required": ["id", "statement"],
      "additionalProperties": false,
      "properties": {
        "id": {
          "type": "string",
          "pattern": "^[a-z][a-z0-9_]*$"
        },
        "statement": {
          "type": "string",
          "minLength": 20
        }
      }
    },
    "preconditions": {
      "description": "Boolean flags that must hold for the vulnerability to apply.",
      "type": "object",
      "minProperties": 1,
      "additionalProperties": { "type": "boolean" }
    },
    "claim": {
      "type": "object",
      "required": ["statement"],
      "additionalProperties": false,
      "properties": {
        "statement": {
          "type": "string",
          "minLength": 20
        }
      }
    },
    "evidence": {
      "description": "Pointers to artifacts in the entry directory. Paths are relative to the entry root.",
      "type": "object",
      "required": ["mode", "vulnerable_fixture", "patched_fixture", "static_rule"],
      "additionalProperties": false,
      "properties": {
        "mode": {
          "type": "string",
          "enum": [
            "fixture_plus_static",
            "fixture_plus_static_plus_test",
            "lean_plus_static_plus_test",
            "lean_plus_fixture_plus_static_plus_test"
          ]
        },
        "vulnerable_fixture": {
          "type": "string",
          "pattern": "^vulnerable_fixture/?$"
        },
        "patched_fixture": {
          "type": "string",
          "pattern": "^patched_fixture/?$"
        },
        "static_rule": {
          "type": "string",
          "pattern": "^rule\\.semgrep\\.ya?ml$"
        },
        "lean_file": {
          "type": "string",
          "pattern": "^theorem\\.lean$"
        },
        "test_runner": {
          "type": "string",
          "default": "node exploit.test.js"
        }
      }
    },
    "detection": {
      "description": "Optional language-agnostic fallback regexes used by `vulnc scan` when Semgrep is not installed. signature_regex matches a substring expected in vulnerable code; exclude_regex (if present) suppresses a match when also found in the same file (the patched-code signature). confidence tells the customer how much triage attention to give the match: HIGH = literal vulnerability shape (e.g., quoted secret with known prefix); MEDIUM = pattern-true but exploitability depends on context; LOW = framework-level signal that fires often and needs human review.",
      "type": "object",
      "additionalProperties": false,
      "properties": {
        "signature_regex": { "type": "string", "minLength": 4 },
        "exclude_regex":   { "type": "string", "minLength": 4 },
        "confidence": {
          "type": "string",
          "enum": ["high", "medium", "low"]
        },
        "languages": {
          "type": "array",
          "items": { "type": "string", "enum": ["javascript", "typescript", "python", "go", "rust", "java", "ruby", "any"] }
        }
      }
    },
    "mitigation": {
      "type": "object",
      "required": ["file", "summary"],
      "additionalProperties": false,
      "properties": {
        "file": {
          "type": "string",
          "pattern": "^mitigation\\.md$"
        },
        "summary": {
          "type": "string",
          "minLength": 20
        }
      }
    },
    "reward": {
      "type": "object",
      "additionalProperties": false,
      "properties": {
        "eligible": { "type": "boolean" },
        "base_reward_tier": {
          "type": "string",
          "enum": ["informational", "low", "medium", "high", "critical", "novel"]
        },
        "royalty_eligible": { "type": "boolean" }
      }
    },
    "contributor": {
      "type": "object",
      "required": ["submitter_id", "validator_id", "canonical_founder"],
      "additionalProperties": false,
      "properties": {
        "submitter_id": { "type": "string", "minLength": 3 },
        "validator_id": { "type": "string", "minLength": 3 },
        "canonical_founder": { "type": "string", "const": "Viridis Security" }
      }
    },
    "references": {
      "type": "array",
      "items": { "type": "string" }
    },
    "version": {
      "type": "string",
      "pattern": "^\\d+\\.\\d+\\.\\d+$",
      "default": "0.1.0"
    },
    "created_at": {
      "type": "string",
      "format": "date"
    },
    "updated_at": {
      "type": "string",
      "format": "date"
    }
  }
}
