{
  "id": "VC-AI-ACTION-0001",
  "title": "Irreversible Action Executed Without Confirmation",
  "class": "AI Agent Irreversible Action",
  "status": "accepted",
  "severity": "high",
  "version": "0.1.0",
  "created_at": "2026-04-27",
  "invariant": {
    "id": "irreversible_actions_require_confirmation_token",
    "statement": "An irreversible side effect (delete, payment, send-email, deploy, fund-transfer) must not be executed by an agent in a single turn without a confirmation token bound to the planned action's hash and the prior turn's session state."
  },
  "preconditions": {
    "tool_has_irreversible_side_effect": true,
    "no_confirmation_token_required": true,
    "single_turn_execution_path_exists": true
  },
  "claim": {
    "statement": "If an agent can call an irreversible tool in the same turn that the user prompt arrives — without an out-of-band confirmation step bound to the planned action — then a single ambiguous prompt, an injection from a retrieved document, or an LLM hallucination can produce permanent damage with no rollback path."
  },
  "evidence": {
    "mode": "fixture_plus_static_plus_test",
    "vulnerable_fixture": "vulnerable_fixture",
    "patched_fixture": "patched_fixture",
    "static_rule": "rule.semgrep.yml",
    "test_runner": "node exploit.test.js"
  },
  "detection": {
    "signature_regex": "irreversible\\s*[:=]\\s*[Tt]rue|\\b(?:delete|destroy|drop|remove|send|transfer|deploy|publish)_[a-z_]+\\.(?:run|execute|call|invoke)\\s*\\(",
    "exclude_regex": "(?:confirmation_token|verifyConfirmation|verify_confirmation|requireConfirmation|require_confirmation|pending_confirmation|two_step|2fa_token|hash\\s*===\\s*plan)",
    "confidence": "medium",
    "languages": ["javascript", "typescript", "python"]
  },
  "mitigation": {
    "file": "mitigation.md",
    "summary": "Tag tools with `irreversible: true`. The dispatcher must require a confirmation_token whose hash equals SHA256(plan_id + tool_name + canonical(args)) and whose generation was logged in the prior turn. Without a matching token, the tool returns a 'pending confirmation' response instead of executing."
  },
  "reward": {
    "eligible": true,
    "base_reward_tier": "high",
    "royalty_eligible": true
  },
  "contributor": {
    "submitter_id": "viridis-security-ai-agent",
    "validator_id": "viridis-security-ai-agent",
    "canonical_founder": "Viridis Security"
  },
  "references": [
    "OWASP LLM08: Excessive Agency",
    "Anthropic — Computer Use Safety Considerations"
  ]
}
