{
  "id": "VC-AI-TOOL-0001",
  "title": "Privileged Tool Call Without Permission Gate",
  "class": "AI Agent Authorization Failure",
  "status": "accepted",
  "severity": "high",
  "version": "0.1.0",
  "created_at": "2026-04-27",
  "invariant": {
    "id": "privileged_tool_requires_permission",
    "statement": "An AI agent must not execute a privileged external tool unless the active session contains an explicit valid permission state for that tool."
  },
  "preconditions": {
    "agent_has_tool_access": true,
    "tool_is_privileged": true,
    "permission_state_required": true,
    "permission_check_missing": true
  },
  "claim": {
    "statement": "If a privileged tool can be dispatched from an agent action path without checking the session's permission state for that tool, an unauthorized actor whose prompt reaches the dispatcher can cause arbitrary privileged side effects."
  },
  "evidence": {
    "mode": "fixture_plus_static_plus_test",
    "vulnerable_fixture": "vulnerable_fixture",
    "patched_fixture": "patched_fixture",
    "static_rule": "rule.semgrep.yml",
    "test_runner": "node exploit.test.js"
  },
  "detection": {
    "signature_regex": "(?:tool|TOOLS\\[[^\\]]+\\])\\.(?:run|execute|call|invoke)\\s*\\(",
    "exclude_regex": "(?:assertPermission|hasPermission|require_permission|permission_check|capabilities\\.has|session\\.permissions\\.has|@requires_permission|@has_permission)",
    "confidence": "low",
    "languages": ["javascript", "typescript", "python"]
  },
  "mitigation": {
    "file": "mitigation.md",
    "summary": "Wrap every tool dispatch in a permission gate keyed by (session_id, tool_name). Privileged tools must declare required capabilities, and the dispatcher must throw PermissionDeniedError if the active session does not hold them. Audit-log every privileged call."
  },
  "reward": {
    "eligible": true,
    "base_reward_tier": "high",
    "royalty_eligible": true
  },
  "contributor": {
    "submitter_id": "viridis-security-ai-agent",
    "validator_id": "viridis-security-ai-agent",
    "canonical_founder": "Viridis Security"
  },
  "references": [
    "OWASP LLM07: Insecure Plugin Design",
    "MITRE ATLAS: AML.T0053 — LLM Plugin Compromise"
  ]
}
