{
  "id": "VC-AI-RAG-0001",
  "title": "Untrusted Retrieved Content Crosses Trust Boundary",
  "class": "AI Agent Trust Boundary Crossing",
  "status": "accepted",
  "severity": "high",
  "version": "0.1.0",
  "created_at": "2026-04-27",
  "invariant": {
    "id": "retrieved_content_must_not_become_instruction",
    "statement": "Untrusted retrieved content must never cross from the data channel into the instruction channel of a model context. Retrieved data may be referenced as content but must not be parsed as agent instructions, tool calls, or policy."
  },
  "preconditions": {
    "agent_uses_retrieval": true,
    "retrieved_corpus_can_be_attacker_controlled": true,
    "retrieved_content_concatenated_into_system_prompt": true,
    "no_channel_separation": true
  },
  "claim": {
    "statement": "If retrieved documents are concatenated into the system or developer prompt without role separation, an attacker who controls any document in the retrieval corpus can inject instructions that the agent will execute, including privileged tool calls and data exfiltration."
  },
  "evidence": {
    "mode": "fixture_plus_static_plus_test",
    "vulnerable_fixture": "vulnerable_fixture",
    "patched_fixture": "patched_fixture",
    "static_rule": "rule.semgrep.yml",
    "test_runner": "node exploit.test.js"
  },
  "detection": {
    "signature_regex": "(?:systemPrompt|system_prompt|instructions?)[^\\n]{0,200}(?:\\$\\{[^}]*(?:retrievedDocs|retrieved_docs|docs|chunks|context_docs)[^}]*\\}|f['\"][^'\"]*\\{(?:retrieved_docs|docs|chunks|context_docs)[^'\"]*['\"]|\\+\\s*(?:retrieved_docs|docs|chunks|context_docs))",
    "exclude_regex": "(?:trustedInstruction|trusted_instruction|untrustedData|untrusted_data|sandboxed_retrieval|data_channel|<retrieved_documents>|role:\\s*['\"]tool['\"])",
    "confidence": "high",
    "languages": ["javascript", "typescript", "python"]
  },
  "mitigation": {
    "file": "mitigation.md",
    "summary": "Tag retrieved content with an explicit data-channel role and surround it with a sandbox boundary the model recognizes. Strip or escape control sequences in retrieved text. Never concatenate retrieved strings directly into the system prompt; use a structured message with role=tool or role=user with clear delimiters."
  },
  "reward": {
    "eligible": true,
    "base_reward_tier": "high",
    "royalty_eligible": true
  },
  "contributor": {
    "submitter_id": "viridis-security-ai-agent",
    "validator_id": "viridis-security-ai-agent",
    "canonical_founder": "Viridis Security"
  },
  "references": [
    "OWASP LLM01: Prompt Injection",
    "OWASP LLM03: Training Data Poisoning (indirect via RAG corpus)",
    "Greshake et al., Indirect Prompt Injection (2023)"
  ]
}
